{
  "artifact_version": 1,
  "generated_by": "hand-maintained: distilled from the retired v1 artifacts on 2026-08-21, never regenerated",
  "note": "WHAT THIS FILE IS FOR. The v1 artifacts were retired once v2 became the single catalogue. Two things in them could not be re-derived, and both are here.\n\n1. THE LEGACY CONTRACT HASHES. Every node the v1 contract described carried a contract_hash computed by an exporter that no longer exists, over a binary serialisation this repository cannot reproduce. Nothing in the runtime reads them -- the generated manifest carries only the current 'c2-' tokens -- but a graph or tool version pinned to one of these remains identifiable because the value survives here. They can never be recomputed, so they are kept rather than dropped.\n\n2. THE ANTI-DELETION GUARD. `gen_artifacts.py --continuity` asserts that every function name and every card id listed here is still present in the live catalogue. That is the guarantee the old --roundtrip provided, at 1 per cent of the weight: it proves nothing that once existed has silently disappeared, without keeping 4.5 MB of superseded artifacts to compare against.\n\nGROWTH IS EXPECTED, LOSS IS NOT. The catalogue is larger than this file and will keep growing; --continuity checks one direction only.\n\n3. THE DECLARED CATEGORY RENAMES. A rename is not a loss, but it looks like one to any membership check, so it is declared here with its date and its reason where a reviewer sees it -- never by relaxing the check. This block replaced corpus/_renames.json, which lost its only reader when the round-trip was retired.",
  "n_nodes": 913,
  "n_cards": 252,
  "contract_hashes": {
    "affluence_line": "c-dc15f755df8abcc1ab7cdf8e497caa89d59e4dab78f9e31ee0d6a26c0e81ed1e",
    "analyze_revisions": "c-828d258ab255cecb989e3392f46896c4108790c1a456393c50a8b95e99214306",
    "ardl_auto": "c-ad95f03742ba457d9d97703b79f4b32bd9abb8e3673587dd973305f19531f059",
    "ardl_bounds_f": "c-248a9a86cd9760e7742933de3dff47d680788fab66e6cff5e49f56c9ee82ceae",
    "ardl_bounds_t": "c-200612ecd0208961c23cc8d99423425f625b0b0bb8b45243e69644acd06ff70f",
    "ardl_coint_eq": "c-ee392267c0f919c98999e9ded8c169cfdfdb13261121dc364f28b9736d09673a",
    "ardl_fit": "c-3965ce828c850ab10b6eac3ba123033769faa7cb24a198952922413ae77f8e9e",
    "ardl_multipliers": "c-916158bed6f0e61d85e06205f4849d7e0d50839fc84005dc4b1b87169370eb65",
    "ardl_recm": "c-86c0c2cba4c00a78cdc7bea3e12df3982ce5aac930637fb8639bf23a3160d0b3",
    "arfima_difference": "c-8fd21de689f29c55c0a32f8bd0cb165d148fc84eec1da5288787bcc33b35313b",
    "arfima_fit": "c-7a0a5056c8903d4f58403a27cdc28dd8431d3e701b5dbf236685a984bf1c2bf4",
    "arfima_gph": "c-ccea0b632925cd5bbc027411f6bf5b429193efc429501162931b2df8c3ba3112",
    "arfima_sperio": "c-e4f3d6dcdcd061d989b1fdf1fc80194e7ecd2324715b525bbe447b68a8209fd0",
    "arpr_gb2": "c-42e2f1a4ecc60e6a1dcb446f06062560e4dfdd5c6fc074e006e06240f7bd4b44",
    "arw_open_dataset": "c-6cc70d4ccf0beedd168aefeb5796ca44454da74cb52713e92fb586db4ad13dea",
    "arw_read_csv": "c-8f6de6f5ecd77e9919dc53575f0b3e2fd3d96299a7f729f861a4d6bb2c66948f",
    "arw_read_feather": "c-bc15cf70c4edc38788bc9b29e84e2e2223cf16d2c41a14b1b1951b437e0d3d55",
    "arw_read_parquet": "c-397e4540cf6328691cc06ffa2f56c6c850344e474b293efe504f8597b5ed3653",
    "arw_write_parquet": "c-372a07e2e23fe0211e3c4779d21bf791b7f83ca5efda093446189dc8acaddd3e",
    "atsm_estimate": "c-04efe0ae69952ba5daa1e045e4ad09d6c94e725a0104cde1d6968929ec238b6a",
    "average_over_phases": "c-e23bdf5dd95770aa594b5aeb44a3ca4d5507b4e75f1cf00af31ec1817ad1c3ac",
    "bacon_decompose": "c-0a694bccd0747bc5856f6c33d68fc5c99883acb10b83677d0b89f7b0632023d2",
    "bday_adjust": "c-c18c595661b40440bd2ad4b439513baf220c5c415011a8f2501abe04f1867d4a",
    "bday_count": "c-ff9f01e91b172d3df90a9efa1eba6e21b6940b5566c44296a872dd4e937f734b",
    "bday_create_calendar": "c-99a848addd4bcfe096f49abdae85981aad509890c37de0434b357382cf826835",
    "bday_offset": "c-f95b8f93042d738060957f7f0538ebb8e92a6faf31af87b7f41b910a8009e12b",
    "bday_sequence": "c-527740b1fe1c54231c2404fbc7d2716a329e927833b2f83bc0114fd34a6bc00d",
    "beast_changepoints": "c-a40d6bc4015188143fc340cc7679baae78fba2f21623bf11721ac586e53b6ac8",
    "beast_decompose": "c-19f82ed8541a83ec438c11443c45c4eb99517039c133185671206a46d8621d28",
    "bekk_estimate": "c-9c2acfbda46bcb15fe8ccbdf3789d185e54ea2da8fc778f3123c0715ab87ae86",
    "bekk_var": "c-c35537940b0b59f6a6402b3869eb481620d43f6a89a344b03489ebf52d8201e3",
    "bekk_virf": "c-b10fb43ab771e67e3b52873930a3f0105717a7708e5b0e2f1fc65de674993a08",
    "bench_annual": "c-c4ff98c4b74ec8f9a12f7d58994aabd59c2016fa6e4addc5b14b35b55bf0a5b0",
    "bench_in_sample": "c-9124b18acb3010b6889f45e6a84d36b9937a9a7ac634379d67199fc1c1867dd7",
    "bench_two_steps": "c-e0c55e06b0ef11bf6d7298fedebddec654cb34c74523c8b6daa167197b9ee9d7",
    "bfast_detect": "c-e10978ed785828862f3131deb047de80c44a1700308b7d2daed3aa3ea2547f4a",
    "bfast_monitor": "c-d6e653601a5c27255ef3dd9d05b0ec65f63bb201d6deb9d0b5cbe08bf365c2fd",
    "bgvar_fit": "c-d50a7d479484abc16b21cf20475dbe2d9a941d4b16b34ea8daeca4a32a425059",
    "bgvar_predict": "c-92ae5f0c0b18d8e3df9e108a7d900cd72d635a695438891fda00ff9a75460884",
    "bgvar_spillover": "c-f9960b7f54277d6a6d5907083fd09ecf214ef011760a8a09054e76c2f451d912",
    "bma_average": "c-3f1b51eca1b021e1bdcd054bb19f1bf1f6a2235e916b108cca36a1b121510079",
    "bma_coefficients": "c-8f03c4825ea3349c7519a19e877ed5cf998938a3a0b7c6d97c1a8dc13e54a67e",
    "bn_apply": "c-c9c2f9d7ed736cbe1a9b281396cd8a45cd578a934872d383319c5c2b27f07447",
    "bn_equal_width": "c-9a64281d281f97b74f5219d6fbcd08618f153bc676bc64ded981038f7c77c14d",
    "bn_quantile_bins": "c-e3548c18d023f10b8d0de2e4ac9d28da79cb1eedce3e6ed969017bc4f669ec74",
    "boost_glm_cv": "c-2e026188ec1a67c490e65eca48c858e74b6bc5ebd98d34b98eeef08eb3fdc981",
    "boost_glm_fit": "c-e943e0d8058a6e94d4791f88a622f840844a331796da3618a226f343e6f54514",
    "boot_adf": "c-d936c12858522eff13dc7db32dc859da85878152359d23cc24ea0cf8a90dbeec",
    "boot_order_integration": "c-a49846ecdc18f331f46a8d8fdcb13f71178a29ef96ce4d4e604f00a14544b8e7",
    "boot_panel": "c-6c408a16ad3c99675424785c8c17a4de135d9631a3fab4b65c2f6728fb06d80f",
    "boot_union": "c-9dcf93faaeb7fce4f60cc8565c596ec3c1cd2da7b23f05bb49936da273959fbe",
    "breg_fit": "c-b6a8baa9e6a6878757a2f630301150c9058c6792e5adcb50060388a77a3a774e",
    "breg_make_formula": "c-c9165843da520687db62be687a71c97859253775819ae442ae085af9a2d7b981",
    "breg_set_prior": "c-213ce67050e513550f73c7407f43b9fea0c3b61636070485899ba3ce31fc1b82",
    "bsp_ar1": "c-67fa668ee5d742639a549e7b1dc85e5fddfe52fcfdb823c4ebb6858543104a7b",
    "bsp_basic_structural": "c-fbc2fdc7ac4b82cf35fdf0e2b3a47b92431e59a88646d14f98c695dfefe6e041",
    "bsp_prior": "c-aff664dcd2a99dec0e41da9317a1e1f5613e7cfd86e89f1f8d9f8f2e4062fa75",
    "bsp_run_mcmc": "c-63f1a6a3483c47f42663637c298e9e57ea9b70596cd7d41416b9ac3a55caf33a",
    "bss_estimate": "c-7c38476bc966d0471a11e5af0a1486217b43137b87fefa5f1043730039fa49e0",
    "bss_fevd": "c-9f6f1d2e8ae97d6f1fabeaf20b236b99eece2467dff882d757ceb2872ed335d1",
    "bss_forecast": "c-072e2ad1b293e8188bebe296edb0118604adc640c12310873dc910c168578136",
    "bss_irf": "c-73156950be1f52c187a592a735c2f2de1a340ddc577779c5a493cff610911d51",
    "bsts_components": "c-fe3a532e36779ed5743183a79b54756bcc47aeb7dfc807fb3f575c862b910ee3",
    "bsts_fit": "c-a3186179579cc7c9e13c221803a3ec4e05cb1e1c9fcf401fc6b9cb7a985db5c4",
    "bsts_predict": "c-78ca0e5446c3be030e8691b22cce245359003bee58a83b8974f5577bc30ad304",
    "bsv_estimate": "c-d0478681188c0c4b3dc8fc6c62dad5f573130d7dd43b691f85176cbf74ca90ce",
    "bsv_fevd": "c-b649f0bdeb21f7a4360cf8db1eda2f2d8b2c46b4da4ce2f13d9d616cf1dd3337",
    "bsv_hd": "c-e9164c7fd57c8b3cd5e7ce98254b16c19195123aec510a837a0e08e31cc875ac",
    "bsv_irf": "c-7209c296f4defe4703f8417c559aa3ddfc4780c44567e428176bde9028bd56a2",
    "bsv_shocks": "c-aa9af1736e98171ec791d4b01e40c2ba74d726f39584db5207734e94b941b894",
    "bsv_verify": "c-34a6a686f59c35b31ceb458834de95a689ef92b0d854d5d80bffa3dc119363e1",
    "bt_fevd": "c-9df4c66a2610f673daeee224220c9a9090f0657f287b2e1364361851aafe24da",
    "bt_irf": "c-8ea860ace2d6700c5c9ad230920e7e8db784faf7088691f383d1c8dfe0381fd3",
    "bt_predict": "c-d09b1bfa40a9cb981a141699085dc0dfd64ce3fd7548f81a6a05408ed92835b2",
    "bt_summary": "c-52259c26a3234adb9c8245e523ca0b4bc13abdd6fba3348a4bbdfa7cb0c09416",
    "bt_var": "c-7bc4c05c2de3bd9f33a15ecc62d3a916a8875160e6bd00c88fba6102be7b752f",
    "bugs_style_mcmc": "c-2b5e603f1c5f790d550034af142e1e857994bf17d35173728970cfaae6806d74",
    "build_er_model": "c-6e74d36a90283ad2cea198b26739c4831cfb0a0f348ae86d0df29cf24c4ad492",
    "build_revision_triangle": "c-e1ef2e8b5f9b8aad28954e337524734264539cdf83edc3330f7d04f0fe6503d1",
    "bvar_companion": "c-2f395ed9c72df3870436932e520064721ec8d9529651964ec337794d38d75298",
    "bvar_estimate": "c-d83e98803445c4de2da67c6fba7c00ffa20f6fd2fa809b4b44560bf913653375",
    "bvar_fevd": "c-01e98d00e06dc285e2183b90909d3e2ccdbe0cc6e881d737b18866a161ff91ed",
    "bvar_irf": "c-fd15f0caf8cdae1eac0cf8c6c0da71f619beab398bb301f8332715fb91672b76",
    "bvar_predict": "c-ed4bf4f729ab751f929b79ce8e4bb2452c06fb4dcd37b715fcb514d1afc4bf59",
    "bvar_summary": "c-e556dc10d707e45d85b49e49520c4327249a153822a7243de5e4519e524a8c45",
    "bvh_predict": "c-85cc29176b85429927355dc9f0babc3faece3d0eff2b5717123e46e415ea0023",
    "bvh_var": "c-50e74062402063dd4e590b98deaec9dab637a4800a46aa2514cd4f16704e20f2",
    "bvh_vhar": "c-c32dede9762e5db6fe842073da0bf6afe6d0e8e813f9b4472617b8419eb212d4",
    "bviz_mcmc_areas_data": "c-4ad477718769b4f12a6b2d281fc1828da5d17ca1938bd7a2ef721363d3bdf38a",
    "bviz_mcmc_intervals_data": "c-bf82b967864507e13249dfeff609ee6d2294fb086bfe79ccb28fdfa1f79f340f",
    "bviz_mcmc_neff_data": "c-3bb143340585de7052482b16d95f91455c3dee8ee8e690fbed314f7b60e2c881",
    "bviz_mcmc_rhat_data": "c-5ae7bbadcca3bef1abfc041921a5fb262253851909c7d7a5272a86d96eaa2aee",